Name,Price
Lily's Sweet's Chocolate Style Bar Salted Caramel Milk Chocolate Style,$5.99
Three Farmers Chickpeas Roasted Dark Chocolate,$6.99
Camino Organic Nightfall Dark,$5.49
HU Hazelnut Butter Dark Chocolate,$8.49
Healthy Crunch Real Cherry Dark Chocolate Superfoods,$8.99
Zazubean Dark Chocolate Sea Salt & Almonds,$4.69
Just Us Dark Chocolate Organic with Cool Mint Filling,$4.79
Green & Blacks Organic Milk Chocolate,$4.79
healthy hippo Swedish Hippos Natural Berry Flavour,$3.99
Green & Blacks Ginger Dark Chocolate,$4.79
"Free2b Sun Cups Minis, Dark Chocolate",$9.99
Camino Organic Bittersweet Chocolate Bar,$5.49
Salento Dark Chocolate Mango,$7.49
"Camino Organic Dark Chocolate Bar, Almonds 55%",$5.49
Enjoy Life Chocolaty Bars Milk Chocolate Flavour Chocolateriz,$3.29
"healthy hippo Hippo Gummies Lemon, Mango, Watermelon, Strawberry Flavour",$3.99
HU Cashew Butter + Pure Vanilla Bean Dark Chocolate,$8.49
Kelloggs Minis Snack Size Bars,$14.99
PC Organics Organics Extra Dark Chocolate,$9.99
Smart Sweets Jolly Gems Hard Candy,$9.99
"Camino Organic Dark Chocolate, Orange",$5.49
healthy hippo Candy Sour Hippo Gummies,$3.99
Panda Licorice Strawberry Candy,$3.99
Lily's Sweet's Chocolate Style Bar Creamy Milk Chocolate Style,$5.99
Theobroma Organic Zero Sugar Special Dark Minis Dark No Sugar Added Chocolate,$6.49
Galerie Au Chocolat Sea Salt Dark Bar,$5.49
Healthy Crunch Real Blueberry Dark Chocolate Superfoods,$8.99
ChocXO Dark Choc Rasp Quinoa,$5.49
Just Us Organic Milk Chocolate,$4.79
Green & Blacks Organic Dark Chocolate With Chopped Roasted Hazelnuts And Currants Imtense Dark,$4.49
Camino Organic Dark Chocolate Intensely Dark,$5.49
Lily's Sweet's Chocolate Style Bar Almond Dark Chocolate Style,$5.99
"Camino Organic Dark Chocolate Bar, Panama Extra Dark 80%",$5.49
Lily's Sweet's Chocolate Style Bar Salted Almond Milk Chocolate Style,$5.99
Herbaland Naturals Inc. Apple Cider Vinegar Gummies,$10.99
Just Us Organic Dark Chocolate,$4.79
Green & Blacks Organic Milk Chocolate Bar with Anglesey Sea Salt,$4.79
"Camino Organic Milk Chocolate Bar, Sea Salt 38%",$5.49
Lily's Sweet's Chocolate Style Bar Sea Salt Extra Dark Chocolate Style,$5.99
Green & Blacks Organic White Chocolate Bar,$4.79
Galerie Au Chocolat Maple Crunch Milk Bar,$5.49
Galerie Au Chocolat 72% Dark Bar,$5.49
"Nature's Path Toaster Pastry, Strawberry",$7.99
That's It Chocolate Date Truffle,$5.99
Yum Earth Candy Organic Chewys,$9.49
Ziggy's Black Forest Ham,$7.00
Ziggy's Smoked Turkey Breast,$7.00
Ziggy's Honey Maple Ham,$7.00
"Schneider Pepperettes Sausage Sticks, European",$11.49
"Schneider Pepperettes Sausage Sticks, Original",$11.49
Ziggy's Cooked Turkey,$7.00
"Maple Leaf Natural Selections Sliced Black Forest Deli Ham, Smoked",$8.49
"Maple Leaf Natural Selections Sliced Deli Turkey Breast, Oven Roasted",$8.49
"Ziggy's Smoked Chicken Breast, Extra Lean",$7.00
Ziggy's Black Forest Ham,$1.99
Ziggy's Montreal Smoked Meat,$7.00
Ziggy's Sub Trio,$7.00
Ziggy's Honey Maple Ham (Thin Sliced),$1.99
Ziggy's Roast Beef,$7.00
Roma Pepperoni Mild Sliced,$9.99
Mastro Genoa Sweet Salami,$6.99
Pillers Kolbassa Sausage,$7.99
Ziggy's Extra Lean Cooked Ham,$7.00
"Schneider Pepperettes Sausage Sticks, Pepperoni",$11.49
President's Choice Pizzeria Style Pepperoni,$4.99
Pillers Turkey Bites Smoked Turkey Sausage Original,$12.99
President's Choice Natural Choice® Deli Assortment,$15.99
Ziggy's Montreal Smoked Meat,$2.99
"Maple Leaf Natural Selections Sliced Black Forest Deli Ham, Smoked, Family Size",$14.99
"Maple Leaf Natural Selections Shaved Deli Turkey Breast, Hickory Smoked",$8.49
President's Choice Free From Turkey,$8.99
"Ziggy's Pepperoni, Sliced",$6.29
Ziggy's Bologna,$7.00
"PC Blue Menu Blue Menu Turkey Breast, Tomato Basil (Thin Sliced)",$3.49
Gold Label Delicatessen Originals Black Forest Ham,$5.00
No Name Pepperoni,$6.99
Mastro Genoa Hot Salami,$6.99
"Maple Leaf Natural Selections Sliced Deli Chicken Breast, Oven Roasted",$8.49
President's Choice Free From Smoked Black Forest Ham,$8.99
Ziggy's Chicken Strips,$8.00
Pillers Dry Cured Sausage Snacks Dill-Icious Pickle,$3.99
Schneider Small Batch Oven Roasted Ham,$3.79
Brandt Liver Sausage Chub,$7.49
Bonte Donair Extra Spicy Donair Meat,$5.99
Chris Brothers Pizza Party Pack,$3.49
Roma Pepperoni Hot Sliced,$9.99
"Maple Leaf Natural Selections Shaved Deli Turkey Breast, Oven Roasted, Family Size",$14.99
Chris Brothers Sliced Deli Pepperoni,$3.29
President's Choice Traditional Black Forest Ham (Thin Sliced),$3.49
No Name Salami Chub,$6.99
Chris Brothers Mild Pepperoni,$5.99
President's Choice Natural Choice Mild Spanish-Style Chorizo Semi-Dry Cured Sausage,$7.99
Gold Label Delicatessen Originals Montreal Smoked Meat,$5.00
"President's Choice Italian Pancetta, Diced",$6.99
Pillers Dry Cured Sausage Snacks Sensational Sour Cream & Onion,$3.99
Ziggy's Turkey Strips,$8.00
Schneider Mock Chicken Loaf,$4.49
"Pepperette, Mild 12-Pack",$6.00
President's Choice Mediterranean Chicken Breast,$3.29
Pillers Semi-Dry Cured Salami Snacks Mild,$3.99
Chris Brothers Premium Sliced Donair,$7.99
"Pillers Liverwurst, Herb",$4.49
Butterball Trio Submarine Turkey Chicken,$7.49
"Pillers Salami Whips, Mild",$5.49
"Maple Leaf Natural Selections Sliced Deli Ham, Baked",$8.49
Chris Brothers Shaved Pastrami,$5.49
President's Choice Country Style Pork Pâté With Garlic,$5.49
Pillers Pepperoni Original,$12.99
President's Choice Natural Choice Old Forrest Salami,$7.49
Mr Donair Donair Meat Loaf Sliced,$6.99
Sikorski Sausages Mini-Kabanos Beef Dried Sausages,$4.79
"Schneider Pepperettes® Sausage Sticks, Hot Pepperoni",$11.49
"President's Choice Free From Oven Roasted Turkey, Club Pack",$15.99
Pillers Hungarian Salami (Thin Sliced),$3.69
PC Splendido Mild Genoa Salami,$3.39
Gold Label Smoke House Naturally Smoked Pepperoni Hot & Spicy,$5.00
Gold Label Smoke House Naturally Smoked Pepperoni Original,$5.00
Brandt Liver Sausage Chub,$7.49
"Pillers Liverwurst, Fine",$4.49
No Name Cooked Ham,$8.29
Maple Leaf Bologna Chub,$2.42
Schneider Small Batch Cajun Turkey Breast,$3.79
Carl Buddig Honey Ham,$2.99
Mastro Salami Genoa,$14.49
Bonte Donair Sliced Donair Meat,$5.99
"Mastro Salami Genoa, Hot Baby",$14.49
Chris Brothers Pizza Variety Pack,$3.49
Ziggy's Extra Lean Cooked Ham,$1.99
Maple Leaf Cooked Ham Loaf,$7.99
"Schneider Pepperettes Bites Sausage Snacks, European",$11.49
Chris Brothers Shaved Turkey Breast,$5.49
President's Choice Traditional Black Forest Ham,$7.99
Mastro Genoa Salami (Thin Sliced),$3.39
Ziggy's Sliced Turkey Pepperoni,$6.29
Pillers Dry Cured Sausage Snacks Smoking Sweet Bbq,$3.99
Bilopage Cretons Original Recipe,$7.99
"Schneider Pepperettes Bites Sausage Snacks, Pepperoni",$11.49
"La Belle Bretagne Glazed Countrystyle Pâté, Cognac",$4.99
Chris Brothers Shaved Roast Beef,$5.49
Chris Brothers All Beef Salami,$4.99
PC Splendido Splendido Dry-Cured Salami Cacciatore with Prosciutto,$11.99
"No Name Bologna, Sliced",$5.29
Sunrise Thin Sliced Bologna,$5.99
Chris Brothers Shaved Roast Beef,$5.49
Chris Brothers All Beef Salami,$4.99
PC Splendido Splendido Dry-Cured Salami Cacciatore with Prosciutto,$11.99
Sunrise Pepperoni Stick,$7.99
Brandt Kolbassa Sausage,$7.29
Chris Brothers Shaved Black Forest Ham,$5.49
President's Choice Free From Stone-Roasted Ham Rosemary & Black Pepper,$8.99
Sila Pizza Delight Pepperoni,$6.99
President's Choice Salami Trio,$7.99
"Schneider Pepperettes Bites Sausage Snacks, Pepperoni",$11.49
Ziggy's Italian-Style Chicken Breast Strips,$8.00
Bonte Donair Beef Donair Kit,$8.99
President's Choice Slow Cooked Angus Roast Beef (Thin Sliced),$4.39
Pillers Pepper Coated Salami,$7.99
President's Choice Oven Roasted Turkey Breast,$7.99
"Freybe Dry Pepperoni Sticks, Honey Garlic",$14.99
PC Splendido Splendido Dry-Cured Salami Cacciatore Mild,$11.99
PC Splendido Splendido Dry-Cured Salami Cacciatore Hot,$11.99
President's Choice Free From Tuscany-Style Roasted Ham,$8.99
PC Splendido Prosciutto,$7.49
"Carl Buddig Turkey, Sliced",$2.99
President's Choice Free From Stone Roasted Ham,$8.99
Sikorski Sausages Mini-Kabanos Spicy Dried Sausages,$4.79
Chris Brothers Deli Meat Combo Pack,$5.99
No Name Chicken Bologna,$3.99
President's Choice Fully Cooked Diced Smoked Ham,$4.99
Sunrise Thick Sliced Bologna,$5.99
Schneider Salami,$4.49
Chris Brothers Bologna,$9.49
Tony's Beef Suet Ground,$4.99
"President's Choice Salami Trio, Club Pack",$12.99
President's Choice Natural Choice Spicy Hungarian Salami,$7.49
Chris Brothers Mild Pepperoni,$1.89
Larsen Smoked Bologna,$13.49
Maple Leaf Natural Selections Shaved Roast Beef Deli Meat,$8.49
Chris Brothers Hot Pepperoni,$5.99
President's Choice Natural Choice Mediterranean Chicken Breast,$7.99
Chris Brothers Thick Sliced Country Style Bologna,$4.99
Gold Label Smoke House Naturally Smoked Pepperoni Honey Garlic,$5.00
Pillers Char Red Wine Salami,$7.99
President's Choice Free From Honey Ham,$8.99
Chris Brothers Smoked Meat Style Montreal,$5.49
"PC Blue Menu Turkey, Tomato & Basil",$7.99
President's Choice Black Forrest Ham with Maple Syrup,$3.49
PC Splendido Hot Genoa,$3.49
No Name Garlic Sausage Coil,$10.99
President's Choice Angus Roast Beef,$7.99
Chris Brothers Shaved Chicken Breast,$5.49
"Schneider Pepperettes Sausage Sticks, Honey Garlic",$11.49
Sikorski Sausages Mini-Kabanos Classic Dried Sausages,$4.79
Brandt Extra Lean Premium Kolbassa Sausage,$7.29
"Ziggy's Pepperoni, Sliced Club Pack",$11.49
PC Splendido Antipasto Misto,$7.49
Sunrise Large Wax Bologna,$21.99
Chris Brothers Mild Pepperoni Link,$17.49
Schneider Bologna,$4.49
Freybe Dry Pepperoni Sticks,$14.99
President's Choice Black Forest Ham,$14.99
Pillers Semi-Dry Cured Salami Snacks Spicy,$3.99
President's Choice Double Cream Brie Cheese,$8.29
PC Splendido Parmigiano Reggiano Hard Ripened Cheese Aged 24 Months,$15.99
"Babybel Original, 18 Pack",$15.99
Babybel Original (6 x 20g),$6.29
Boursin Herbs Garlic Cheese,$5.99
Saputo Feta in Brine,$6.79
"Zerto Parmesan, Shredded",$8.39
Babybel Original Semi-soft Ripened Cheese 12 x 20g,$10.49
President's Choice Ricotta Cheese,$7.49
President's Choice Provolone Sliced Cheese,$7.49
Boursin Shallot & Chive,$5.99
President's Choice Crumbled Goat's Milk Féta Cheese,$6.99
Ziggy's Swiss Cheese Slices,$8.79
"Saputo Feta in Brine, Light",$6.79
Balderson Cheddar Cheese Extra Old 35% M.F.,$10.29
"Tre Stelle Feta, Cubes",$9.49
"The Laughing Cow Cheese, Spreadable",$5.49
Tre Stelle Mozzarella Ball,$9.79
President's Choice Cheddar Cheese Sliced Medium 33% M.F. Club Pack,$13.49
Ziggy's Creamy Havarti Cheese Slices,$8.79
President's Choice Feta Cheese In Brine,$9.49
Parmigiano Reggiano,$13.73
President's Choice Sliced Swiss Cheese,$7.49
President's Choice Goat Cheese,$5.49
President's Choice Double Cream Brie Cheese,$14.99
Tre Stelle Ricotta,$8.49
Ziggy's Mozzarella Ball,$8.79
President's Choice Creamy Havarti Cheese Slices,$7.49
Ziggy's Mild Cheddar Cheese Slices,$8.79
The Laughing Cow Original,$15.49
PC Blue Menu Soft Unripened Goat's Milk Cheese,$5.49
Balderson Old Cheddar,$10.29
President's Choice Sliced Medium Cheddar Cheese,$7.49
Castello Traditional Blue Wedge,$8.99
PC Splendido Grana Padano Hard Ripened Cheese Aged 14 Months,$8.99
President's Choice Swiss Cheese,$7.99
President's Choice Cranberry Goat Cheese,$5.49
President's Choice Sliced Marble Cheddar Cheese,$7.49
Saputo Parmesan Petals,$12.49
Saputo Mozzarella Fresca,$6.49
President's Choice Swiss Cheese Sliced 30% M.F. Club Pack,$13.49
Cows Creamery Aged 1 Year 32% M.F. Cheddar Cheese,$8.59
President's Choice Light Feta In Brine,$9.49
"Woolwich Cheese, Chevrai Roasted Garlic",$6.79
Tre Stelle Mascarpone,$9.49
Tre Stelle Cheese Lupa Pecorino Romano 33% M.F.,$11.99
"Tre Stelle Ricotta, Light",$8.49
Balderson 1-Yr Old Aged Cheddar Slices,$7.49
Kerrygold Blarney Castle Smooth & Mild Gouda Cheese 31 % M.F.,$6.99
"Castello Cream Cheese Spread, Pineapple",$5.29
Castello Tickler Extra Mature Cheddar Cheese 35% M.F.,$8.99
President's Choice Brie Triple Crème Brie Cheese,$9.99
President's Choice Old Cheddar Cheese Block,$7.99
Castello Havarti Jalapeno FW,$8.29
President's Choice Aged 1 Year Canadian Cheddar Cheese,$9.29
Balderson Medium Cheddar,$10.29
President's Choice Canadian Cheddar Aged 5 Years,$13.49
"Boursin Apple And Maple, Fresh Soft White Cheese",$5.99
PC Splendido Pecorino Romano,$8.29
Castello Havarti Dill FW,$8.29
Boursin Truffle Salt & Hint of Pepper,$5.99
Babybel 2 Go,$1.79
President's Choice Medium Cheddar Cheese,$7.99
PC Black Label Le Gruyère Antique Hard Ripened Cheese Aged 12 Months,$12.29
President's Choice Sliced Old White Cheddar Cheese,$7.49
PC Black Label West Country Farmhouse Cheddar Cheese,$7.99
Henri Willig Mild Gouda,$9.99
Ile De France Petit Brie Cheese,$6.29
President's Choice Monterey Jack Cheese With Jalapeño,$7.99
Cows Creamery Unsalted Creamery Butter,$5.99
President's Choice Sliced Smoked Gouda Cheese,$7.49
Tre Stelle Bocconcini,$7.99
The Laughing Cow Cheese wedges,$11.49
PC Blue Menu Ricotta Cheese,$7.49
Agropur Signature Notre-Dame Brie Cheese,$8.69
PC Black Label Parmesan,$11.49
Saputo Shredded Parmesan Cheese,$9.49
Cheese Classic 2 Year Old Cheddar 32% M.F.,$7.29
Saputo Grilling Cheese Haloumi With Mediterranean Spices 26% M.F.,$8.29
PC Splendido Provolone Cheese Provolone Valpadana 26% M.F.,$5.79
Mature Cheddar Cheese,$5.74
Bothwell Cheddar Cheese Maplewood Smoked Extra Old 32% MF,$8.99
"Tre Stelle Bocconcini, Pearls",$7.99
Cows Creamery Sea Salted Creamery Butter,$5.99
Cows Creamery Cheddar Cheese 37% M.F. Avonlea Clothbound Cheddar,$15.49
"Balderson 2-Year Old Royal Canadian White Cheddar, Snack Size",$7.99
Castello Extra Creamy Blue Cheese Wedge,$8.99
President's Choice Cheese Washed-Rind Soft Surface-Ripened,$8.69
"President's Choice Canadian White Cheddar, Aged 2 Years",$9.99
PC Blue Menu Goat Cheese,$10.69
PC Blue Menu Sliced Light Swiss Cheese,$7.49
President's Choice Goat’S Milk Chèvre Crumbled Soft Unripened Cheese,$6.99
PC Black Label Roquefort Blue Cheese,$8.99
Tre Stelle Greek Style Cheese Traditional Feta 22% M.F.,$11.49
President's Choice Herbed Goat's Milk Cheese,$5.49
Monsieur Gustav Medium Gouda,$6.69
PC Black Label Roquefort Blue Cheese,$8.99
Tre Stelle Greek Style Cheese Traditional Feta 22% M.F.,$11.49
President's Choice Herbed Goat's Milk Cheese,$5.49
Monsieur Gustav Medium Gouda,$6.69
Tre Stelle Mascarpone,$15.69
Saputo Gourmet Chalet Cheese,$17.99
President's Choice Herbed Soft Unripened Goat’s Milk Cheese,$10.69
Ivanhoe Old Sharp Cheese,$10.38
Galbani Fresh Soft Cheese Mozzarella Fresca 18 % M.F.,$7.19
Castello Cheese Cheddar Savoury Onion 34% M.F.,$8.99
"President's Choice Havarti With Jalapeno, Sliced",$7.49
Monsieur Gustav Old Gouda,$7.69
President's Choice Creamy Havarti Cheese Sliced 32% M.F. Club Pack,$13.49
"President Feta Cheese, Crumbled",$7.49
Tre Stelle Halloumi,$6.49
"Saputo Cheese, Bocconcini Cocktail Light",$7.49
"Zerto Fresh Mozzarella, Sliced",$10.49
Boursin Pepper,$5.99
President's Choice Cranberry Soft Unripened Goat’s Milk Cheese,$10.69
"President's Choice Medium Cheddar Cheese, Portions",$15.99
Boursin Fig & Balsamic,$5.99
Cows Creamery Aged 3 Years 32% M.F. Cheddar Cheese,$9.69
"President's Choice Raclette Sliced Washed-Rind, Firm Surface-Ripened Cheese",$7.49
President's Choice Spicy Cheddar Cheese,$6.99
PC Black Label Taster Pack,$10.49
President's Choice Mozzarella Cheese,$8.79
President's Choice Camembert Cheese,$8.29
PC Black Label Manchego Sheep's Milk Hard Ripened Cheese Aged 6 Months,$7.29
PC Black Label White Stilton With Mango & Ginger Hard Unripened Cheese,$8.79
Bradbury's The Craic Cheddar,$6.29
Boursin Cranberry & Pepper,$5.99
PC Black Label Hard Ripened Cheese,$9.79
Jarlsberg Cheese,$10.69
President's Choice Halloom Semi-Soft Unripened Cheese,$7.99
"President's Choice Goat Milk Cheese, Peppercorn",$5.49
President's Choice Herb & Garlic Halloom,$7.99
"President's Choice Herb & Spice Havarti, Sliced",$7.49
President's Choice Triple Cream Blue Brie,$9.99
"President's Choice Medium Cheddar Cheese Block, Club Pack",$15.49
President's Choice Canadian Cheddar Aged 2 Years,$17.49
Agropur Signature Agropur Grand Cheddar 5 Years-Old Aged Cheese,$10.49
PC Splendido Mascarpone,$9.99
Balderson Double Smoked Cheddar Slices,$7.49
Saputo Comté Firm Surface Ripened Cheese M.F. 32%,$13.29
Dofino Canadian Havarti,$14.69
Armstrong Gouda Cheese 28% M.F.,$3.65
Balderson Gouda 1 year old,$8.99
PC Blue Menu Light Swiss Cheese Sliced 18% M.F. Club Size,$13.49
President's Choice Medium Dutch Gouda Cheese,$6.39
"Tre Stelle Bocconcini, Mini",$7.99
Castello Havarti Creamy FW,$8.29
PC Black Label Isle Of Man Extra Old Cheddar Cheese Aged 14 Months,$7.79
Saputo Comté Firm Surface Ripened Cheese M.F. 32%,$13.29
Balderson 2-Year Old Royal Canadian White Cheddar,$21.99
Balderson 2-Year Old Royal Canadian Cheddar,$10.99
President Président Brie Cheese 28 % M.F.,$15.99
Bothwell Squeak'rs White Cheese Curds,$9.29
President's Choice Le Gruyere AOP Cheese,$16.99
"PC Splendido Grana Padano Wedge, Large",$23.49
"Madame Chevre Chevre, Cranberry with Port",$7.49
Castello Arla Havarti Herb&Spice FW,$8.29
Armstrong Gouda Cheese 28% M.F.,$3.65
PC Splendido Mascarpone,$9.99
Balderson Double Smoked Cheddar Slices,$7.49
Dofino Canadian Havarti,$14.69
"President's Choice Sliced Light Havarti Cheese, Club Pack",$13.49
Balderson Marble Cheddar,$10.29
Saputo Shredded Romano Cheese,$9.49
PC Splendido Parmigiano Grated,$4.29
Saputo Feta Cheese Lactose Free 22 % M.F.,$6.49
Babybel Swiss,$6.29
Cows Creamery Smoked Cheddar Cheese Appletree Smoked 32% M.F.,$8.99
"President's Choice Sliced Provolone Cheese, Club Pack",$13.49
Saputo Ricotta,$8.69
Woolwich Goat Milk Feta Cheese,$22.99
Tre Stelle Lactose Free Feta Cheese,$5.49
"Tre Stelle Pizza Mozzarella Cheese Deluxe Mozzarella 25 % M.F., Lactose Free",$9.49
Woolwich Goat Party Pack Cheese,$11.29
Yorkshire Wensleydale Cheese With Cranberries 30% M.F.,$6.79
Oka Aged Cheese,$10.99
President's Choice Sliced Gouda Cheese,$7.49
Saputo Haloumi Plain 26% M.F. Semi-Soft Unripened Cheese,$8.79
Saputo Feta Cheese Sheep & Goat 22 % M.F.,$8.49
Balderson Monterey Jack Cheddar Slices,$7.49
"Tre Stelle Bocconcini, Light",$7.99
PC Black Label Red Fox Red Leicester Hard Ripened Cheese Aged 18 Months,$8.29
Balderson Double Smoked Cheddar,$8.79
President's Choice Old Dutch Gouda Cheese,$6.89
President's Choice Goat's Milk Mozzarella,$9.99
"Kerrygold Irish Cheddar, 2-Year Aged",$6.99
Castello Cheese Aged Havarti 36% M.F.,$8.29
"President's Choice Coloured Old Cheddar Cheese, Club Pack",$15.49
President's Choice Herb & Spice Havarti Cheese Block,$7.99
President's Choice Aged 2 Years Canadian Cheddar Cheese,$9.99
Boursin Fresh Soft White Cheese Minis Garlic & Fine Herbs 39 % M.F.,$5.99
Kerrygold Dubliner Cheese,$6.99
The Laughing Cow Garlic & Herbs Process Cheese Product 24 Portions Of 16.7 G (400 G),$11.49
Castello Cheese Cheddar Cracked Black Pepper 34% M.F.,$8.29
Cathedral City Mature Cheddar Cheese,$6.79
President's Choice Goat Brie Goat’s Milk Brie Cheese,$6.99
Monsieur Gustav Saint-Paulin Cheese,$10.99
Bradbury's Punchtown Irish Metre Cheese,$6.79
"Galbani Fresh Mozzarella, Marinated",$12.49
Galbani Fresh Soft Cheese Mozzarella 20 % M.F.,$7.29
Kaserei Limburger Cheese,$9.69
Saputo Feta Cheese 1 kg,$21.99
Yorkshire Wensleydale With Cranberries 30% M.F.,$9.99
PC Splendido Parmigiano Petals,$4.29
President's Choice Sliced Monterey Jack with Jalapeno Cheese,$7.49
The Laughing Cow Light Creamy Swiss,$11.49
Oka Mushroom and Truffles Cheese,$10.99
"PC Blue Menu Cheese, Brie Light",$8.29
President's Choice Original Soft Unripened Goat’s Milk Cheese,$10.69
Homestead Feta Cheese,$7.99
President's Choice Cheese Le Michabou,$8.69
President's Choice Garlic & Herb Crumbled Goat's Milk Feta,$6.99
Monsieur Gustav Mild Gouda,$6.69
President's Choice Creamy Havarti Cheese,$7.99
Cows Creamery Extra Old Cheddar 32% M.F. Cheddar Cheese,$7.99
"Balderson Cheese, 1 Year Old Championship Cheddar",$8.99
President's Choice Blue Cheese,$7.29
Bradbury Saxon Cross Smoked Cheddar,$6.99
Alexis Portneuf Camembert Cheese Double Crème Mild,$5.79
President Garlic Herb Cheese,$4.69
Homestead Feta Cheese,$22.49
"Zerto Asiago, Shredded",$8.39
"President's Choice Mozzarella, Sliced",$7.49
President's Choice Gouda Cheese Block,$7.99
The Laughing Cow Garlic & Herb,$5.49
Oka Original Cheese,$10.99
"President's Choice L'Abbé Wash-Rind, Firm Surface-Ripened Cheese",$7.49
Saputo Poutine Cheese Curds,$6.79
"Babybel Light, 18 Pack",$15.99
President's Choice Bocconcini,$6.99
Platter Fruit Small,$15.00
Large Fruit Platter With Dip,$25.00
Tripak Fruit,$15.00
Large Vegetable Platter,$22.00
Fiesta Dip Tray,$10.00
Meat And Cheese Lunch Tray,$6.00
Cheese And Grape Lunch Tray,$6.00
Cantaloupe Spears,$11.00
Everyday Cheese Board,$12.00
Hormel Deli Tray with Pepperoni and Genoa Salami,$25.00
Pineapple Spears,$11.00
Cheese & Grape Nibbler,$10.00
Snack Platter Apple Almonds,$8.00
Snack Platter Cheese Almond,$8.00
"12 Inch Spinach & Pumpernickel Tray, Requires 24 Hour Notice",$12.00
Cheese Nibbler,$12.00
Cheese and Grape Tray,$12.00
Fiesta Dip Tray,$15.00
Honeydew Spears,$11.00
"Pineapple, Cantaloupe & Honeydew Melon Spears",$11.00
Hormel Snack Tray,$12.49
Cheese And Pepperette Tray,$18.00
Small Cheese & Pepper Tray,$1.20
24hr Notice Required - Cheese Snacker Tray,$25.00
"Fruit and Cheese Snack Tray, Requires 24 Hour Notice",$15.00
Garlic Hummus and Nann Bread Tray,$14.99
"Meat and Cheese Snack Tray, Requires 24 Hour Notice",$15.00
24hr Notice Required - Meat and Cheese Nibbler (Regular),$40.00
24hr Notice Required - Meat and Cheese Nibbler (Large),$50.00
"24hr Notice Required - Cheese, Fruit and Cracker Snacker",$50.00
Sabra Hummus Roasted Red Pepper,$5.29
President's Choice Hummus,$4.29
President's Choice Tzatziki Yogurt Dip,$4.29
President's Choice Roasted Garlic Hummus Chickpea Dip & Spread,$4.29
President's Choice Hummus Chickpea Dip And Spread,$7.49
Sabra Classic hummus,$5.29
President's Choice Roasted Red Pepper Dip,$4.29
President's Choice Artichoke & Asiago Dip,$4.29
President's Choice Spinach Dip,$4.29
Sabra Hummus Roasted Garlic,$5.29
President's Choice Spinach Dip,$7.49
President's Choice Pico De Gallo Mild Salsa,$5.99
President's Choice Baba Ghanouj,$4.29
"President's Choice Hummus, Mini",$4.29
PC Blue Menu Tzatziki,$4.29
President's Choice Everything Bagel Hummus,$4.29
President's Choice Olive Tapenade Hummus Chickpea Dip & Spread,$5.29
"President's Choice Chunky Guacamole, Original",$7.49
"President's Choice Chunky Guacamole, Original",$4.99
"President's Choice Roasted Garlic, Red Pepper & Cumin Hummus Chickpea Dip And Spread",$5.29
President's Choice Bruschetta Topping With Roasted Vegetables,$4.29
President's Choice Mini Roasted Garlic Hummus Chickpea Dip And Spread,$4.29
Yucatan Guacamole Authentic Flavor 6 Cups,$6.99
PC Organics Organic Hummus Chickpea Dip & Spread,$4.29
President's Choice Spicy Hummus,$4.29
President's Choice Fiesta 5-Layer Dip,$7.99
President's Choice Avocado Hummus,$4.29
President's Choice Za'atar Hummus,$5.29
Sabra Hummus Roasted Pine Nut,$5.29
Casa Grande de Quintanas Grande Salsa Roja,$5.49
Sardo Jalapeño Feta Cheese,$5.29
Sardo Olives,$5.79
Sardo Pitted Kalamata Olives,$5.29
Sardo Party Mix Olives,$5.79
Sardo Olive Bruschetta,$6.29
Comeau Seafood & Shrimp Spread,$5.29
"President's Choice Salsa, Fresh Mild",$5.79
President's Choice 4-Layer Loaded Pierogi Dip,$7.99
Sardo Garlic & Red Pepper Stuffed Olives,$9.29
Sardo Jumbo Pitted Green Olives,$5.79
President's Choice Plant Based Cucumber Dil Cashew Dip,$4.99
Sardo Stuffed Mammoth Green Olives,$5.79
Sardo Marinated Artichokes,$8.29
President's Choice 5-Layer All Dressed Dip,$7.99
Sardo Black Olive Tapenade,$6.29
Sardo Homestyle Greek Antipasto,$5.79
Sardo Grilled Forest Mushrooms,$8.29
Sardo Garlic Stuffed Green Olives,$6.29
President's Choice Beet Hummus Chickpea Dip And Spread,$5.29
Sardo Basil Pesto,$6.29
Ritz Original Snacking Crackers,$3.99
Christie Toppables Crackers,$3.99
President's Choice Sea Salt Crackers,$3.49
President's Choice Traditional Naan Dippers,$4.29
"The Snack Factory Pretzel Crisps, Original",$5.49
Pepperidge Farm Mega Bites Sharp Cheddar,$3.99
President's Choice Rosemary Crackers,$3.49
Dare Breton Garden Vegetable Crackers,$3.89
Dare Breton Original Crackers,$3.89
"Wheat Thins Original Snacking Crackers, Family Size",$3.99
Wheat Thins Multigrain Snacking Crackers,$3.99
Wheat Thins Vegetable Thin Snacking Crackers,$3.99
Quaker Crispy Minis All Dressed Flavour Brown Rice Chips,$3.79
Ritz 65 Percent Less Sodium Snacking Crackers,$3.99
Ritz Swiss Cheese Snacking Crackers,$3.99
Pepperidge Farm Mega Bites Cheddar Jalapeno,$3.99
Quaker Crispy Minis Tortilla Farmhouse Cheddar Flavour Brown Rice Chips,$3.79
Ritz Cheese Snacking Crackers,$3.99
"The Snack Factory Pretzel Crisps, Garlic Parmesan",$5.49
Ritz Cheese Nibs Snacking Crackers,$3.99
Quaker Crispy Minis Tortilla Sour Cream & Chive Flavour Brown Rice Chips,$3.79
President's Choice Water Crackers,$3.49
"Ritz Cheese Bits, Cheddar",$3.99
"The Snack Factory Pretzel Crisps, Everything",$5.49
Dare Veggie Crisps Cracker Chips All Dressed,$3.89
"Wheat Thins Vegetable Thins Crackers, Less Fat",$3.99
President's Choice Garlic Crackers,$3.49
Dare Breton Basil and Olive Oil Crackers,$3.89
President's Choice Fine Cracker Assortment,$5.49
Ritz Bacon Crackers,$3.99
Quaker Crispy Minis Brown Rice Chips Sweet & Thin Cocoa Crunch,$3.79
Quaker Crispy Minis Brown Rice Chips Sweet & Thin Salted Caramel,$3.79
Cheez-It Crackers Double Cheese Flavour Snack,$4.49
Ritz Mini Cheese Crackers,$3.99
Ritz Sociables Crackers,$3.99
Triscuit Thin Crisps Jalapeno Crackers,$3.99
Cheez-It Crackers Cheddar Sour Cream & Onion Flavour Snack,$4.49
"President's Choice Mini Pita Crackers, Sea Salt",$3.49
Skyflakes M.Y Sans Crackers,$7.29
PC Black Label Cranberry and Fennel Artisan Crisps,$6.00
PC Black Label Apricot and Rosemary Artisan Crisps,$6.00
"Dare Breton Crackers, Garden Vegetable, Gluten Free",$3.89
President's Choice Crisp & Thin Vegetable Crackers,$3.49
