Name,Price
Gatorade Zero Variety Flavour,$21.99
"Gatorade Zero, Berry",$6.99
Gatorade Fierce Cool Blue Sports Drink,$2.49
Gatorade G2 Clubpack Sports Drink,$21.99
Gatorade G Zero Grape Sports Drink,$6.99
Monster Energy Original,$3.99
"Gatorade Zero, Orange",$6.99
Gatorade Glacier Cherry Sports Drink,$6.99
Gatorade Orange Sports Drink,$6.99
Gatorade Fruit Punch Sports Drink,$6.99
"Gatorade G2, Grape",$6.99
Starbucks Frappuccino Vanilla Coffee Drink,$3.99
Gatorade Performance Fruit Punch,$7.49
Gatorade Lemon Lime Sports Drink (Case),$6.99
Gatorade Zero Cool Blue Sports Drink,$2.49
Red Bull Energy Drink,$3.49
Starbucks Frappuccino Mocha Coffee Drink,$3.99
Gatorade Fierce Fruit Punch Sports Drink,$2.49
Monster Energy Ultra Peachy Keen,$3.99
Gatorade Fierce Orange Sports Drink,$2.49
Gatorade Fierce Lemon Lime Sports Drink,$2.49
"Gatorade Performance, Orange",$7.49
"Powerade Electrolyte Beverage, Mixed Berry, Bottle",$2.49
Gatorade GFIT Tropical Mango,$2.99
"Red Bull Energy Drink, Sugar Free",$3.49
Gatorade Fierce Glacier Cherry Sports Drink,$2.49
Gatorade GFIT Watermelon Strawberry,$2.99
Gatorade Zero Fruit Punch Sports Drink,$2.49
Prime Hydration Hydration Drink Ice Pop,$3.49
Monster Energy Ultra Fiesta,$3.99
"Gatorade G2, Fruit Punch",$6.99
Gatorade Frost Glacier Freeze Sports Drink,$6.99
Monster Energy Ultra Rosa,$3.99
"Peace Tea Peach Party Cans, 12 Pack",$7.99
Gatorade Frost Arctic Blitz,$6.99
"Powerade Team Pack Electrolyte Beverage, Bottle 24 Pack",$18.99
Gatorade Frost Glacier Freeze Powder,$7.49
Monster Energy Zero Sugar,$3.99
"Red Bull Energy Drink, Watermelon",$4.49
"Rockstar Pure Zero, Mandarin Energy Drink",$3.99
Rockstar Pure Zero Strawberry Mango Energy Drink,$3.99
Gatorade Frost Orange (Instant) Powder,$7.49
Red Bull Energy Drink,$4.49
Gatorade Frost Orange (Instant) Powder,$7.49
Red Bull Energy Drink,$4.49
Rockstar Punched Strawberry,$3.99
"Red Bull Energy Drink, Tropical, Pack 4",$11.49
"Powerade Zero Sugar Electrolyte Beverage, Orange Flavour",$2.49
Orangina Sparkling Citrus Beverage,$9.49
Monster Energy Java Salted Caramel,$3.99
"Powerade Mixed Berry Electrolyte Beverage, Bottle 6 Pack",$6.99
28 BLACK 28 Black Classic Energy Drink,$2.29
"Powerade Zero Calorie Electrolyte Beverage, Grape, Bottle",$2.49
Prime Hydration Hydration Drink Lemon Lime,$3.49
"Powerade Electrolyte Beverage, Grape, Bottle",$2.49
Serge Flavoured Milk Drink,$1.69
Rockstar Revolt Black Cherry Energy Drink,$3.99
"Powerade Zero Calorie Electrolyte Beverage, Blue Rasberry, Bottle",$2.49
Monster Energy Zero Ultra,$4.49
Guru Organic Energy Drink,$3.99
"Red Bull Energy Drink, Sugar Free",$4.49
Monster Energy Reserve White Pineapple,$3.99
Monster Energy Punch Mango Loco,$12.49
Rockstar Pure Zero Punched Energy Drink,$3.99
"Powerade Electrolyte Beverage, Blue Raspberry, Bottle",$6.99
Monster Energy Ultra Blue,$3.99
"Gatorade G2, Orange",$6.99
"Powerade Electrolyte Beverage, Orange, Bottle",$2.49
Rubicon Sparkling Passion Fruit Beverage,$2.29
"Core Power Banana High-Protein Milk Shake, Bottle",$4.49
Six Star Elite Series Pre-Workout Explosion Ripped Pink Lemonade,$28.99
Rockstar Punched Peach,$3.99
Red Bull Energy Drink,$4.99
"Red Bull Energy Drink, Sugar Free",$4.99
"Central Dairies Sugar Free, 24-Pack",$43.49
Monster Energy Punch Mango Loco,$3.99
Monster Energy Ultra Gold,$3.99
Bang Blue Razz Energy Drink,$3.49
Full Throttle Citrus,$3.99
Rockstar Original Energy Drink,$3.99
Monster Energy Java Loca Moca,$3.99
Reign Reignbow Sherbet,$11.99
Monster Energy Ultra Watermelon,$3.99
Monster Energy Original,$23.99
"Red Bull Energy Drink, Watermelon, Pack 4",$11.49
Pure North Black Cherry,$3.79
Monster Energy Pipeline Punch,$3.99
"Red Bull Energy Drink, Sugar Free",$18.99
Rockstar Caffeinated Energy Drink Grape,$3.99
"Core Power Strawberry Banana High-Protein Milk Shake, Bottle",$4.49
Red Bull Energy Drink,$18.99
Rockstar Caffeinated Energy Drink Grape,$3.99
"Core Power Strawberry Banana High-Protein Milk Shake, Bottle",$4.49
"Red Bull Energy Drink, Peach-Nectarine",$11.49
"Red Bull Energy Drink, Sugar Free",$11.49
Pure North Grapefruit Lemonade,$3.79
"Powerade Fruit Punch Electrolyte Beverage, Bottle 6 Pack",$6.99
Monster Energy Punch Khaotic,$3.99
Red Bull Energy Drink,$18.99
Red Bull The Winter Edition Energy Drink Fig-Apple,$11.49
Monster Energy Ultra Red,$3.99
Peace Tea Razzleberry,$7.99
Pure North Cucumber Lime,$3.79
"Core Power Vanilla High-Protein Milk Shake, Bottle",$4.49
Rockstar Punched Orange,$3.99
Rockstar Pure Zero Lemonade,$3.99
Monster Energy Original,$11.99
Coca-Cola Coffee Dark Blend,$3.49
Gatorade G FIT Citrus Berry,$7.99
"Powerade Electrolyte Beverage, Melon Pinnapple, Bottle",$2.49
Bang Bangster Berry Energy Drink,$3.49
Monster Energy Java Mean Bean,$3.99
Monster Energy Rehab Tea+Lemonade,$3.99
Red Bull The Winter Edition Energy Drink Fig-Apple,$3.49
"Red Bull Energy Drink, Blueberry, Pack 4",$11.49
Monster Energy Rehab Peach Tea,$3.99
Monster Energy Zero Ultra,$11.99
Rockstar Revolt Grape Energy Drink,$3.99
"Powerade Electrolyte Beverage, Fruit Punch, Bottle",$2.49
Rockstar Pure Zero Watermelon,$3.99
Reign White Gummy Bear,$3.99
Monster Energy Zero Sugar,$11.99
Prime Hydration Hydration Drink Blue Raspberry,$3.49
Monster Energy Punch Aussie Style Lemonade,$3.99
"Red Bull Energy Drink, 4 Pack (Case)",$14.49
Gatorade G FIT Tropical Mango,$7.99
NOS Original,$4.49
"Rockstar Energy Drink, Green Apple",$3.99
Coca-Cola Coffee Vanilla,$3.49
Rockstar Punched Blackberry,$3.99
Red Bull Energy Drink,$29.99
"Red Bull Energy Drink,",$11.49
NOS Original,$3.99
Monster Energy Original,$4.49
Rockstar Sugar Free,$3.99
Reign Reignbow Sherbet,$3.99
Monster Energy Lo-Cal,$3.99
Starbucks Triple Shot French Vanilla,$3.99
"Core Power Chocolate High-Protein Milk Shake, Bottle",$4.49
Monster Energy Zero Ultra,$23.99
Monster Energy Assault,$3.99
Monster Energy Pacific Punch,$3.99
Monster Energy Ultra Violet,$3.99
Reign Orange Dreamsicle,$3.99
President's Choice Orange Pekoe Premium Black Tea,$10.99
"Nestea Lemon Tea, Cartons 10 Pack",$4.29
"Nestea Iced Tea, Lemon",$7.99
Carnation Hot Chocolate,$6.49
Starbucks Medium Roast Iced Coffee,$9.99
Starbucks Blonde Roast Iced Coffee,$9.99
Pure Leaf Lemon Iced Tea,$4.99
President's Choice Lemon Ginger Herbal Tea,$4.29
"Peace Tea Peach Party Tea, Can",$1.29
"Carnation Simply Hot Chocolate, Canister",$5.99
President's Choice Chocolate Milk Mix,$6.99
Carnation Hot Chocolate Mix,$5.99
"Nestea Zero Iced Tea, Lemon",$7.99
Carnation Marshmallow Hot Chocolate Canister,$5.99
"Peace Tea Razzleberry Tea, Can",$1.29
Peace Tea Strawberry Lemon Tea,$1.29
President's Choice Camomile Herbal Tea,$4.29
Carnation Variety Pack Hot Chocolate Envelopes,$6.49
Peace Tea Sno-Berry,$1.29
Tetley Peppermint Herbal Cannister Pack,$4.99
President's Choice Chai Black Tea,$4.29
Tim Hortons Hot Chocolate,$6.99
Tetley The Orange Pekoe,$6.99
Wahaha Yogurt-Flavored Drink,$2.29
President's Choice Ginger Peach Herbal Tea,$4.29
No Name Hot Chocolate Mix,$4.49
"Peace Tea Caddy Shack Tea, Can",$1.29
Tetley Orange Pekoe Black Tea,$15.99
President's Choice Spiced Apple Herbal Tea,$4.29
"Lynch Hot Apple Cider Mix, Original",$6.49
President's Choice The Decadent Hot Chocolate Mix,$5.99
Red Rose Orange Pekoe Black Tea,$6.79
Pure Leaf Raspberry Iced Tea,$4.99
"Peace Tea Peach Tea, Cherry",$1.29
Red Rose Orange Pekoe Black Tea 100% Rainforest Alliance Certified,$13.99
"Gold Peak Lemon Tea, Jug",$7.49
No Name Hot Chocolate Mix,$16.99
Tetley Super Tea immune lemon & Echinacea with Zinc,$4.99
"Carnation Rich And Creamy Hot Chocolate, Large Canister",$20.99
Twinings 20ct Pure Peppermint,$4.99
President's Choice Dark Chocolate Peppermint Candy Hot Cocoa Mix,$5.99
Peace Tea Mango Mood,$1.29
Carnation Marshmallow Hot Chocolate Sachets,$6.49
Tetley Decafeine Orange Pekoe,$8.99
President's Choice Mint Refresher Herbal Tea,$4.29
No Name 2-Cup Black Tea Bags,$3.49
Tetley Black Tea Earl Grey Decaffeinated,$6.99
Tetley Herbal Tea Live Balanced Chicory Root Dandelion Reishi,$6.49
Crystal Light Iced Tea Powdered Drink Mix Pitcher Packs,$4.49
"DAVIDsTEA Tea, Naturally Flavoured Matcha Drink Mix",$13.99
Twinings 50ct Pure Peppermint,$10.99
Brooke Bond Red Label Black Tea,$6.29
Twinings Lemon & Ginger Tea,$10.99
Snapple Zero Lemon tea,$1.99
Tim Hortons Hot Chocolate Sachet,$6.49
Twinings Individual Tea Bags Sealed For Freshness English Breakfast,$16.99
DAVIDsTEA Fruit Infusion Caribbean Crush,$9.99
Twinings Cold Infuse- Strawberry Lemon Tea,$5.99
DAVIDsTEA Herbal Infusion Mother'S Little Helper Organic,$9.99
Snapple Zero kiwi Strawberry,$1.99
"King Cole Orange Pekoe Tea, King Cup",$11.99
President's Choice Moroccan Style Mint Green Tea,$4.29
King Cole Green Tea,$5.49
"Lipton Lemon Ginseng Green Tea, 100% Rainforest Alliance Certified",$7.99
Twinings Flavoured Herbal Tea Peach & Orange,$4.99
Yorkshire Tea Yorkshire Gold Orange Pekoe Tea,$8.99
Lipton Black Tea Extra Strong Flavour,$7.99
"Tazo Herbal Tea Passion Hibiscus, Orange peel and Passion Fruit Flavours",$6.99
DAVIDsTEA Black Tea Cream Of Earl Grey Organic,$9.99
Tetley Chai Specialty Tea,$4.99
Tetley Care Lemon Ginger Herbal Tea,$4.99
Aasana Relax Herbal Tea Mandarin Orange,$6.99
"Gold Peak Rasberry Tea, Bottle",$3.99
Stassen Jasmine Green Tea,$7.29
Tetley The Orange Pekoe,$11.99
Tim Hortons Steeped Tea Orange Pekoe Blend 12 K-Cup Pods,$13.99
DAVIDsTEA Organic Blueberry Matcha,$13.99
Celestial Seasonings Cinnamon Apple Spice Herbal Tea,$5.99
Twinings 20ct Honeybush Mandarin Orange,$4.99
Twinings 20ct Chai,$4.99
"Tetley Green Tea, Decaf",$6.99
Twinings Goodnight Blend Herbal Tea,$4.99
Tetley Vanilla Bean Chai Tea,$4.99
Nature Extra Strength,$6.99
HAO TEA China Green Tea,$4.99
President's Choice Premium Flavoured Black Tea,$5.49
"President's Choice Tea, Premium Flavoured Black  Earl Grey Decaffeinated",$5.49
Twinings 50ct Earl Grey,$10.99
Tetley Herbal Tea Live Calm Camomile Spearmint Orange,$4.99
Nin Jiom Pei Pa Koa,$5.99
"Tim Hortons K-Cup Hot Chocolate, Original",$13.99
Starbucks Signature Hot Chocolate Mix 40% Cocoa,$13.99
Tetley Pomegranate Green Specialty Tea,$4.99
Tetley Earl Grey The Speciaux,$8.99
Tetley Earl Grey The Speciaux,$8.99
Tea India Tea,$9.49
"King Cole Orange Pekoe Tea, Decaf",$5.49
Tazo Zen Tea Bag,$4.99
Twinings 20ct Earl Grey,$4.99
Twinings 20ct Earl Grey Decaf,$4.99
Twinings Earl Grey,$9.79
Tetley Naturally Flavoured Black Tea Chai Original,$6.99
Tetley Earl Grey Tea 48 Tea Bags,$6.99
Twinings 50ct English Breakfast,$10.99
Brooke Bond Red Label Black Tea,$15.49
King Cole Orange Pekoe Loose Leaf Tea,$9.99
Tetley English Breakfast Tea,$5.49
Tim Hortons Hot Beverage Sachet,$13.99
"Tazo Calm Chamomile Tea Chamomile, Rose Petals and Soothing Herbs",$4.99
DAVIDsTEA White Tea Buddha'S Blend,$9.99
President's Choice Hibiscus White Tea,$4.29
Tim Hortons French Vanilla Capp Sachet,$6.49
"Mr Brown Iced Coffee, Blue Mountain",$1.79
President's Choice Lemon Thriller Herbal Tea,$4.29
Twinings Superblends Flavoured Herbal Tea Lemon & Ginger,$4.99
Celestial Seasonings Peppermint Herbal Tea,$5.99
Twinings Superblends Fortified Green Tea Citrus & Ginger With Echinacea,$4.99
Camino Organic Dark Hot Chocolate,$5.99
"Celestial Seasonings Herbal Tea, Fruit Sampler",$5.99
King Cole Orange Pekoe Tea,$5.49
Twinings Superblends Flavoured Herbal Tea Spiced Apple & Vanilla,$4.99
Aasana Relax Herbal Tea Peppermint,$6.99
Twinings 100ct Earl Grey,$16.99
Yorkshire Tea Yorkshire Gold Tea,$8.99
Twinings Cold Infuse-Watermelon & Mint Tea,$5.99
Yorkshire Tea Loose,$8.99
Twinings Green Tea,$10.99
Tetley Turmeric Echinacea Herbal Tea,$4.99
President's Choice Dreamland Herbal Tea,$4.29
Tetley Herbal Tea Live Happy Mango Passionfruit Lion's Mane,$6.49
DAVIDsTEA Herbal Infusion Cold 911 Organic,$9.99
Taylors of Harrogate Yorkshire Orange Pekoe Tea,$6.99
Tetley Super Herbal Tea Sunshine Lemon & Orange With Vitamin D,$4.99
"Ujinotsuyu Tea, Green  with Roasted Rice Genmaicha",$4.79
Twinings Creamy Vanilla Earl Grey Tea,$4.99
Gold Peak Naturally Flavoured Blueberry Iced Tea,$3.99
Nestea Raspberry Bottle,$2.99
Twinings 20ct English Breakfast,$4.99
Camino Organic Simply Dark Hot Chocolate,$7.49
Tetley Rooibos Tea,$6.99
Tim Hortons Orange Pekoe Tea,$8.99
Tazo Organic Chai Te Bag,$4.99
Celestial Seasonings Bengal Spice Herbal Tea,$5.99
Ovaltine Malted Chocolate Drink,$6.99
Tetley Earl Grey Decaffeinated Specialty Cannister Pack,$4.99
Morse Orange Pekoe Tea Bag,$5.49
T&T Organic Green Tea,$7.29
President's Choice Chocolatey Chai Herbal Tea,$4.29
Tetley The Vert Classique,$8.99
Gold Kili Instant Ginger Latte With Honey,$4.49
Tazo Organic Chai Te Bag,$4.99
President's Choice Premium Black Tea Orange Pekoe,$6.49
"King Cole Orange Pekoe Tea, Decaffeinated",$14.99
Nestea Raspberry Can,$7.99
Tata Loose Black Tea,$6.99
Starbucks Classic Hot Cocoa K-Cup Pods Box,$13.99
President's Choice Cucumber Mint Flavour Green Tea,$2.99
Brisk Lemon Iced Tea,$1.69
Society Tea Black Tea,$19.49
"Lipton Green Tea Tea Naturally Decaffeinated, 100% Rainforest Alliance Certified",$7.99
Tetley Cozy Cinnamon Camomile Herbal Tea,$4.99
President's Choice Feeling Calm Camomile Citrus Herbal Tea,$4.29
"President's Choice Green Tea, Club Pack",$5.49
Typhoo Decaf Tea,$10.99
DAVIDsTEA Cinnamon Rooibos Chai Organic,$9.99
Tetley Dream Camomile/Lemon Herbal Cannister Pack,$4.99
Celestial Seasonings Flavoured Black Tea Earl Grey Crème,$5.99
Twinings 20ct Pure Camomile,$4.99
Gold Kili Matcha Latte Instant 10,$5.99
Nestea Iced Tea Natural Lemon Flavour,$3.49
Twinings 20ct Variety Pack,$4.99
Celestial Seasonings Sleepytime Vanilla Herbal Tea,$5.99
Twinings Superblends Herbal Tea Peppermint & Fennel,$4.99
President's Choice Chocolatey Peppermint Herbal Tea,$4.29
President's Choice Cold Brew Nitro Black Coffee,$3.79
"Tazo Tea, Herbal  Turmeric Bliss For A Smooth & Comforting Sensation",$4.99
Twinings 20ct English Breakfast Decaf,$4.99
Tetley Green Tea The Vert Classique 48's,$6.99
Tetley Green Tea Lemon,$6.99
Snapple Zero Peach tea,$1.99
Twinings Superblends Flavoured Herbal Tea Orange & Star Anise,$4.99
Tetley Tea Pure Ceylon,$5.49
Twinings African Rooibos Red Tea,$4.99
Tetley The corse orange pekoe - Corse,$5.49
Tetley Bellini Herbal Tea,$4.99
Tetley Super Herbal Tea Immune+ Peppermint & Ginger With Zinc And Vitamin D,$4.99
"Carnation Aero S'Mores Hot Chocolate, Envelopes",$6.49
President's Choice Ruby Hot Cocoa Mix,$5.99
Wagh Bakri Bakri Premium Tea,$13.99
President's Choice Chocolatey Peppermint Herbal Tea,$4.29
President's Choice Cold Brew Nitro Black Coffee,$3.79
"Tazo Tea, Herbal  Turmeric Bliss For A Smooth & Comforting Sensation",$4.99
Twinings 20ct English Breakfast Decaf,$4.99
Tetley Green Tea The Vert Classique 48's,$6.99
Wagh Bakri Bakri Premium Tea,$13.99
Tetley Green Tea Lemon,$6.99
"Red Rose Tea, Orange Pekoe  Bold & Delicious Blend For a Smooth Sensation",$11.99
Brisk Blackberry Iced Tea,$1.69
Brisk Peach Iced Tea,$1.69
Tetley Mint Green Specialty Tea,$4.99
Tetley Cleanse Lemon Balm and Honey,$4.99
DAVIDsTEA Organic Vanilla Matcha,$13.99
Tazo Herbal Tea Iced Passion,$4.99
Aasana Relax Herbal Tea Rooibos Lemon Sunshine,$6.99
Twinings 100 Green Tea,$16.99
Typhoo Tea,$6.49
President's Choice Naturally Decaffeinated Green Tea,$4.29
DAVIDsTEA Loose Leaf Tea Rooibos Tea Headache Halo,$9.99
DAVIDsTEA Fruit Infusion Just Peachy,$9.99
Tim Hortons Black Tea Steeped Tea Orange Pekoe Blend,$23.99
Twinings English Breakfast,$9.79
Tetley Herbal Tea Clarity Blueberry Ginseng Tea,$4.99
DAVIDsTEA Loose Leaf Tea Black Tea Vanilla Cappuccino,$9.99
Celestial Seasonings Decaffeinated Black Tea English Breakfast,$5.99
Celestial Seasonings Sleepy Time Tea,$8.49
"DAVIDsTEA Tea, Loose Leaf  Green  Blood Orange Boost",$9.99
Nestea Original Lemon Iced Tea,$15.99
Aasana Relax Herbal Tea Blue Nile Chamomile,$6.99
Tetley Pure Green Specialty Tea,$4.99
Twinings 20ct Green Tea & Lemon,$4.99
Twinings 20ct Lady Grey,$4.99
"Tetley Tea, Super Herbal  Camomile & Turmeric with Multivitamins",$4.99
Tetley Earl Grey Vanilla Specialty Cannister Pack,$4.99
Tetley Super Green Matcha,$4.99
Tazo Wild Sweet Orange Tea,$4.99
Twinings Herbal Tea Goodnight Blend,$10.99
"Red Rose Tea, Orange Pekoe Black , 100% Rainforest Alliance Certified",$4.29
Tazo Refresh Mint  Herbal Tea,$4.99
"Twinings Tea, Camomile, Honey & Vanilla Herbal",$4.99
Twinings 20ct Lemon & Ginger,$4.99
"Carnation Hot Chocolate Mix, Cookies and Creme - 7 sachets",$6.49
President's Choice Maple Rooibos Red Tea,$4.29
"Tetley Tea, Honey Lemon Ginseng Green Specialty",$4.99
DAVIDsTEA Loose Leaf Tea Herbal Infusion Valerian Nights,$9.99
"Twinings Tea, Pomegranate & Raspberry Herbal",$4.99
"Ovaltine Malted Drink, Classic",$6.99
HAO TEA Jasmine Tea,$4.99
King Cole Orange Pekoe Tea,$14.99
DAVIDsTEA Loose Leaf Tea Fruit Infusion Frozen Raspberry,$9.99
President's Choice Dark Roast Black Cold Brew Coffee,$5.99
"Peace Tea Greenest of All Teas Tea, Can",$1.29
Ovaltine Malted Milk Drink,$6.99
Celestial Seasonings Sleepytime Herbal Tea,$5.99
Gold Kili Instant Ginger Tea Latte With Honey,$4.49
Twinings Flavoured Herbal Tea Raspberry & Lemon,$4.99
Tetley Super Tea Boost Berry Burst With Vitamin B6,$4.99
President's Choice Lavender Flavour White Tea,$2.99
PG Tips Original Black Tea Bags,$6.49
"President's Choice Feeling Soothed Peppermint, Ginger & Fennel Herbal Tea",$4.29
Lipton Yellow Label Green Tea 100% Rainforest Alliance Certified,$7.99
Twinings 50ct Pure Camomile,$10.99
Twinings Orange & Cinnamon Spice Tea,$4.99
President's Choice Decaf Orange Pekoe Tea,$5.49
Tetley Herbal Tea Live Bold Cinnamon Chai Rooibos,$4.99
President's Choice Raspberry Thriller Herbal Tea,$4.29
Tetley Super Herbal Tea-Boost Peach Ginger Dan with Vitamin B6,$4.99
Tetley Super Green Tea Antiox Tropical With Vitamin C,$4.99
Tim Hortons Hot Chocolate Mix Smooth & Creamy,$13.99
President's Choice Rooibos Red Tea,$4.29
Aasana Relax Herbal Tea Berry Berry Blast,$6.99
Celestial Seasonings Wild Berry Zinger Herbal Tea,$5.99
Tetley Decafeine Orange Pekoe,$6.99
Celestial Seasonings Bengal Spice Herbal Tea,$8.49
Tetley Green Tea Naturally Decaffeinated,$4.99
"King Cole Orange Pekoe Tea, Decaf King Cup",$11.99
Twinings Cold Infuse- Mango Passion Fruit Tea,$5.99
Twinings Peppermint & Creamy Vanilla,$4.99
Tetley Warmth Cinnamon Spice Herbal Cannister Pack,$4.99
"Tea India Tea, Masala Chai Black  with Real Spices",$6.99
"Tazo Tea, Ginger  Bright Green  &  Sweet Note of Pear",$4.99
Twinings 20ct Irish Breakfast,$4.99
Camino Organic Original Milk Hot Chocolate,$5.99
President's Choice Dirty Chai Black Tea with Espresso Coffee,$4.29
"Pure Leaf Brewed Iced Tea Less Sugar, Lemon",$4.99
"Gold Peak Lemon Tea, Bottle",$3.99
Tazo Chai Latte Tea Concentrate,$4.99
Starbucks Signature Hot Chocolate Mix Salted Caramel,$13.99
Tazo English Breakfast Tea Bag,$4.99
Nestlé Carnation Hot Chocolate Mix Turtles,$5.99
"Nestea Peach Tea, Cartons 10 Pack",$4.29
Brisk Zero Lemon Iced Tea,$1.69
President's Choice Natural Spring Water 24 Pack,$3.99
Nestlé Purelife Natural Spring Water,$6.49
"PC Blue Menu Lime Sparkling Water, 12-Pack",$4.99
"Bubly Sparkling Water Lime Sparkling Water Beverage, 12 Pack",$6.99
PC Blue Menu Calamansi Citrus and Strawberry Sparkling Water,$4.99
"PC Blue Menu Lemon Sparkling Water, 12-Pack",$4.99
President's Choice Natural Spring Water,$1.99
PC Blue Menu Blueberry Pomegranate Sparkling Water,$4.99
Bubly Sparkling Water Raspberry,$6.99
PC Blue Menu Mandarin Orange Sparkling Water With Natural Flavour (Case),$4.99
PC Blue Menu Pink Grapefruit Sparkling Water,$4.99
Bubly Sparkling Water Blackberry Sparkling Water,$6.99
President's Choice Free & Clear Black Cherry Sparkling Water,$1.29
Bubly Sparkling Water Pineapple Sparkling Water,$6.99
Bubly Sparkling Water Sparkling Water Cherry,$6.99
President's Choice Free & Clear Golden Peach Sparkling Water,$1.29
Bubly Sparkling Water Peach Sparkling Water,$6.99
President's Choice Free & Clear Tangerine-Lime Sparkling Water,$1.29
Sparkling Ice Kiwi Strawberry Sparkling Water,$2.49
PC Blue Menu Sparkling Water (Case),$4.99
Sparkling Ice Cherry Limeade Sparkling Water,$2.49
Bubly Sparkling Water Grapefruit Bubly,$6.99
Bubly Sparkling Water Orange Bubly,$6.99
PC Blue Menu Lime Sparkling Water,$1.29
Sparkling Ice Black Raspberry Sparkling Water,$2.49
President's Choice Free & Clear Key Lime Sparkling Water,$1.29
PC Blue Menu Peach Mango Sparkling Flavoured Water,$1.29
President's Choice Orange Cream Soda Flavour Sparkling Water,$4.99
Sparkling Ice Orange Mango Sparkling Water,$2.49
PC Blue Menu Lemon Sparkling Water,$1.29
President's Choice Natural Spring Water,$1.29
President's Choice Ginger Ale Flavour Sparkling Water,$4.99
PC Blue Menu Watermelon Sparkling Water,$4.99
President's Choice Root Beer Flavour Sparkling Water,$4.99
President's Choice Cranberry Ginger Ale Flavour Sparkling Water,$4.99
Sparkling Ice Coconut Pineapple Sparkling Water,$2.49
Montellier Carbonated Natural Spring Water,$1.59
President's Choice Cream Soda Flavour Sparkling Water,$4.99
PC Blue Menu Natural Sparkling Water,$1.29
Sparkling Ice Lemon Lime Sparkling Water,$2.49
"Glaceau Acai-Blueberry-Pomegranate Nutrient Enhanced Water, Bottle",$2.99
Thirsty Buddha Coconut Water,$29.99
Action Alkaline Water,$2.99
"Fruit2O Fruit 2O Sparkling Water, Grape",$1.99
Ocean Spray Sparkling Cranberry Mango Beverage,$7.49
"Glaceau Water with Sports Cap, Bottle",$3.29
PC Blue Menu Mandarin Orange Sparkling Water,$1.29
President's Choice Vanilla Cherry Soda Flavour Sparkling Water,$4.99
Ocean Spray Sparkling Lite Cranberry,$7.49
"Propel Kiwi Strawberry Enhanced Water with Gatorade Electrolytes, 6 Pack",$7.49
"Glaceau Water, Bottle",$3.49
"Glaceau Focus Nutrient Enhanced Water, Bottle",$2.99
President's Choice Lime Carbonated Natural Spring Water,$1.99
"Glaceau Water, Zero Calorie Rise Bottle Nutrient Enhanced , Bottle",$2.99
Lacroix Grapefruit Water,$5.49
Sparkling Ice Blue Raspberry Sparkling Water,$2.99
Nestlé Purelife 0 Calories,$1.79
4L Water Bottle,$1.99
Simple Drop Support Raspberry Enhanced Water Beverage,$1.79
Cycle Carbonated Spring Water,$2.49
Whistler Glacial Spring Water,$1.99
Ocean Spray Sparkling Cranberry Beverage Pink Cranberry,$7.49
"San Pellegrino Sparkling Drinks, Blood Orange & Orange Blossom",$8.99
Sparkling Ice Citrus Twist Sparkling Water,$2.99
Fruit2O Sparkling Blueberry Lime Twist,$1.99
Simple Drop Active Strawberry Enhanced Water Beverage,$1.79
Sparkling Ice Orange Passion Fruit Sparkling Water,$2.99
"Perrier Carbonated Natural Spring Water, Lime",$8.99
Silk Fortified Oat Beverage Original,$3.49
"San Pellegrino Sparkling Natural Mineral Water, Tangerine & Wild Strawberry",$9.99
San Pellegrino Naturali Pompelmo Sparkling Grapefruit Beverage,$8.99
"Glaceau Multi-V Nutrient Enhanced Water, Bottle",$2.99
Daydream Sparkling Water Infused With Hemp Oil & Adaptogens Blackberry Chai,$5.99
San Pellegrino Original Sparkling Natural Mineral Water,$9.99
"President's Choice Sparkling Water, Cola Flavoured, 12 Pack",$4.99
PC Blue Menu Pineapple Coconut Sparkling Water,$1.29
President's Choice Strawberry Mist Naturally Fruit-Flavoured Water Beverage,$4.29
President's Choice Peach Mist Naturally Fruit-Flavoured Water Beverage,$4.29
Glaceau Alkaline with Antioxidant,$3.49
AQUAFINA water,$6.99
PC Blue Menu Pink Grapefruit Sparkling Water,$1.29
Whistler Glacial Spring Water,$4.29
"San Pellegrino Sparkling Natural Mineral Water, Lemon & Lemon Zest",$9.99
President's Choice Raspberry Mist Naturally Fruit-Flavoured Water Beverage,$4.29
Nestlé Purelife Sparkling Carbonated Spring Water,$1.39
"Dasani Water, Bottle",$2.79
Lacroix Lime Water,$5.49
Lacroix Cranberry Raspberry,$5.49
PC Blue Menu Watermelon Sparkling Water,$1.29
"Bai Antioxidant Infusion, Molokai Coconut, 6 Pack",$13.99
Perfectly Clear 7.5L Fridge Bottle,$15.99
"Bai Water, Low Calorie Beverage Ipanema Pomegranate",$2.99
Bai Coconut Molokai,$2.99
Simple Drop Support Peach Enhanced Water Beverage,$1.79
"Cycle Canadian Spring Water, Resealable Can",$2.49
San Pellegrino Sparkling Drink Lemon & Raspberry,$8.99
"Thirsty Buddha Sparkling Coconut Water, Watermelon",$2.49
AHA Pineapple Passion Fruit Sparkling Water,$6.99
AHA Blueberry Pomegranate,$6.99
"Dasani Water, Bottle",$3.99
Perfect Hydration 9.5+ Ph Alkaline Water,$1.99
Nestlé Purelife Natural Spring Water,$4.29
Dasani Remineralized Water,$8.49
"Zevia Zero Sugar Energy Drink, Kola",$2.49
Bai Blueberry Brasilia,$2.99
Perfectly Clear Round 18.9L Bottle,$13.99
Round Bottle,$13.99
"Fruit2O Fruit 2O Sparkling Water, Strawberry",$1.99
"Evian Spring Water, Bottle",$3.99
Bubly Sparkling Water Strawberry Bubly,$6.99
Thirsty Buddha All Natural Coconut Water,$6.49
"Thirsty Buddha Sparkling Coconut Water, Pineapple",$2.49
San Pellegrino Naturali Aranciata Sparkling Orange Beverage,$8.99
Coca-Cola Water Bottle,$2.99
"Perrier Original Carbonated Natural Spring Water, No Calories, No Sweeteners, No Sodium, Can",$9.99
San Pellegrino Sparkling Drink Pomegranate & Blackcurrant,$8.99
Glaceau Squeezed Zero Calorie Nutrient Enhanced Water Bottle,$2.99
President's Choice Original Carbonated Natural Spring Water,$1.99
San Pellegrino Naturali Melograno & Arancia Sparkling Orange & Pomegranate Beverage,$8.99
"Perrier Raspberry Carbonated Natural Spring Water with Natural Flavour, No Calories, No Sweeteners, No Sodium, Can",$9.99
Perrier Carbonated Natural Spring Water,$5.99
Flow Water Alkaline Spring Water,$2.99
San Pellegrino Naturali Arancia & Fico D'India Sparkling Orange & Prickly Pear Beverage,$8.99
Fiji Natural Artesian Water,$3.29
"Perrier Lemon Carbonated Natural Spring Water with Natural Flavour, No Calories, No Sweeteners, No Sodium, Can",$9.99
"Perrier Lime Carbonated Natural Spring Water with Natural Flavour, No Calories, No Sweeteners, No Sodium, Can",$9.99
"Glaceau Water, Bottle",$3.99
Vita Coco Coconut Water Original,$3.29
President's Choice Natural Spring Water,$0.99
Simple Drop Natural Spring Boxed Water,$1.79
Perrier Sparkling Strawberry & Kiwi Beverage,$8.49
Glaceau Smart Water,$14.99
"San Pellegrino Sparkling Natural Mineral Water, Blood Orange & Black Raspberry",$9.99
